{
  "given_name" : "John",
  "family_name" : "Smith",
  "middle_name" : "Scott",
  "address" : {
    "formatted" : "221B Baker Street\nLondon\nNW1 9NT\nGreat Britain",
    "postal_code" : "NW1 9NT",
    "country" : "Great Britain",
    "country_code" : "GB"
  },
  "email" : "John.Smith@abc.uk",
  "birthdate" : "1950-01-01",
  "uk_gov_nino" : "AA000003D",
  "hmrc_enrolments": [
    {
      "key": "IR-SA",
      "identifiers": [
        {
          "key": "UTR",
          "value": "174371121"
        }
      ],
      "state": "Activated"
    }
  ],
  "government_gateway":
  {
    "user_id": "019283",
    "roles": ["User"],
    "affinity_group": "Individual",
    "user_name": "John",
    "agent_code": "123456-abc",
    "agent_friendly_name": "AC Accounting",
    "agent_id": "AC",
    "gateway_token": "token-value-1234",
    "unread_message_count": 0
  },
  "mdtp": {
    "device_id": "device_id-12345",
    "session_id": "session_id_123455"
  }
}
